<?xml version="1.0" encoding="UTF-8"?>
<ehcache xmlns:xsi="http://www.w3.org/2001/XMLSchema-instance"
         xsi:noNamespaceSchemaLocation="http://ehcache.org/ehcache.xsd">

    <!-- File for use in non-clustered environments (no terracotta) -->


    <!-- Sets the path to the directory where cache .data files are created. If the path is a Java System Property it is replaced
        by its value in the running VM. The following properties are translated: user.home - User's home directory user.dir - User's
        current working directory java.io.tmpdir - Default temp file path -->
    <diskStore path="ehcache.disk.store.dir"/>

    <!-- Customize caches below. Increase or decrease maxElementsInMemory; 10000 genes takes about 10 MB in RAM. Make items
        that are essentially immutable 'eternal'. -->

    <!-- see http://ehcache.sourceforge.net/documentation/configuration.html -->

    <!-- Hibernate -->

    <cache name="org.hibernate.cache.internal.StandardQueryCache" maxElementsInMemory="5000" timeToLiveSeconds="1200"
           timeToIdleSeconds="1200" overflowToDisk="false"/>

    <cache name="org.hibernate.cache.spi.UpdateTimestampsCache" maxElementsInMemory="5000"
           eternal="true" overflowToDisk="false"/>

    <!-- cache names must match the class element names defined in the hbm.xml files. -->

    <!-- gsec -->

    <cache name="gemma.gsec.acl.domain.AclSid"
           maxElementsInMemory="100" eternal="true" overflowToDisk="false"/>
    <cache name="gemma.gsec.acl.domain.AclObjectIdentity"
           maxElementsInMemory="10000" timeToLiveSeconds="1200" overflowToDisk="false"/>
    <cache name="gemma.gsec.acl.domain.AclObjectIdentity.entries"
           maxElementsInMemory="10000" timeToLiveSeconds="1200" overflowToDisk="false"/>
    <cache name="gemma.gsec.acl.domain.AclEntry"
           maxElementsInMemory="100000" timeToLiveSeconds="1200" overflowToDisk="false"/>

    <!-- Gemma -->

    <cache name="ubic.gemma.model.analysis.expression.diff.HitListSize"
           maxElementsInMemory="100000" eternal="true" overflowToDisk="false"/>

    <cache name="ubic.gemma.model.genome.sequenceAnalysis.BlatResult"
           maxElementsInMemory="100000" eternal="true" overflowToDisk="false"/>

    <cache name="ubic.gemma.model.genome.sequenceAnalysis.SequenceSimilaritySearchResult"
           maxElementsInMemory="100000" eternal="true" overflowToDisk="false"/>

    <cache name="ubic.gemma.model.genome.sequenceAnalysis.BlatAssociation" maxElementsInMemory="100000"
           timeToLiveSeconds="1200" overflowToDisk="false"/>

    <cache name="ubic.gemma.model.genome.biosequence.BioSequence" maxElementsInMemory="200000"
           timeToLiveSeconds="1200" overflowToDisk="false"/>

    <cache name="ubic.gemma.model.genome.biosequence.BioSequence.bioSequence2GeneProduct"
           maxElementsInMemory="10000" timeToLiveSeconds="1200" overflowToDisk="false"/>

    <cache name="ubic.gemma.model.genome.gene.GeneAlias" maxElementsInMemory="50000"
           timeToLiveSeconds="1200" overflowToDisk="false"/>

    <cache name="ubic.gemma.model.genome.gene.GeneProduct" maxElementsInMemory="50000"
           timeToLiveSeconds="1200" overflowToDisk="false"/>

    <cache name="ubic.gemma.model.genome.gene.GeneProduct.accessions" maxElementsInMemory="50000" eternal="true"
           overflowToDisk="false"/>

    <cache name="ubic.gemma.model.genome.gene.GeneProduct.exons" maxElementsInMemory="50000" eternal="true"
           overflowToDisk="false"/>

    <cache name="ubic.gemma.model.genome.gene.GeneSetMember" maxElementsInMemory="50000" timeToLiveSeconds="1200"
           overflowToDisk="false"/>

    <cache name="ubic.gemma.model.genome.gene.GeneSet" maxElementsInMemory="10000"
           timeToLiveSeconds="1200" overflowToDisk="false"/>

    <cache name="ubic.gemma.model.genome.gene.GeneSet.characteristics" maxElementsInMemory="1000"
           timeToLiveSeconds="1200" overflowToDisk="false"/>

    <cache name="ubic.gemma.model.genome.gene.GeneSet.members" maxElementsInMemory="1000"
           timeToLiveSeconds="1200" overflowToDisk="false"/>

    <cache name="ubic.gemma.model.genome.gene.Multifunctionality" maxElementsInMemory="50000"
           timeToLiveSeconds="1200" overflowToDisk="false"/>

    <cache name="ubic.gemma.model.genome.PhysicalLocation" maxElementsInMemory="10000"
           timeToLiveSeconds="1200" overflowToDisk="false"/>

    <cache name="ubic.gemma.model.genome.ChromosomeFeature" maxElementsInMemory="200000"
           timeToLiveSeconds="1200" overflowToDisk="false"/>

    <cache name="ubic.gemma.model.genome.Chromosome" maxElementsInMemory="1200" eternal="true" overflowToDisk="false"/>

    <cache name="ubic.gemma.model.genome.Taxon" maxElementsInMemory="100"
           timeToLiveSeconds="1200" overflowToDisk="false"/>

    <cache name="ubic.gemma.model.genome.Gene" maxElementsInMemory="50000"
           timeToLiveSeconds="1200" overflowToDisk="false"/>

    <cache name="ubic.gemma.model.genome.Gene.products" maxElementsInMemory="50000" eternal="true"
           overflowToDisk="false"/>

    <cache name="ubic.gemma.model.genome.Gene.aliases" maxElementsInMemory="50000" eternal="true"
           overflowToDisk="false"/>

    <cache name="ubic.gemma.model.genome.Gene.accessions" maxElementsInMemory="200000" eternal="true"
           overflowToDisk="false"/>

    <cache name="ubic.gemma.model.common.description.DatabaseEntry" maxElementsInMemory="200000"
           eternal="true" overflowToDisk="false"/>

    <cache name="ubic.gemma.model.common.description.ExternalDatabase" maxElementsInMemory="100"
           timeToLiveSeconds="1200" overflowToDisk="false"/>

    <cache name="ubic.gemma.model.common.description.LocalFile" maxElementsInMemory="10000"
           timeToLiveSeconds="1200" overflowToDisk="false"/>

    <cache name="ubic.gemma.model.common.description.BibliographicReference" maxElementsInMemory="10000"
           timeToLiveSeconds="1200" overflowToDisk="false"/>

    <cache name="ubic.gemma.model.common.description.BibliographicReference.annotations" maxElementsInMemory="10000"
           timeToLiveSeconds="1200" overflowToDisk="false"/>

    <cache name="ubic.gemma.model.common.description.BibliographicReference.meshTerms" maxElementsInMemory="10000"
           timeToLiveSeconds="1200" overflowToDisk="false"/>

    <cache name="ubic.gemma.model.common.description.BibliographicReference.keywords" maxElementsInMemory="10000"
           timeToLiveSeconds="1200" overflowToDisk="false"/>

    <cache name="ubic.gemma.model.common.description.BibliographicReference.chemicals" maxElementsInMemory="10000"
           timeToLiveSeconds="1200" overflowToDisk="false"/>

    <cache name="ubic.gemma.model.common.description.Characteristic" maxElementsInMemory="200000"
           timeToLiveSeconds="1200" overflowToDisk="false"/>

    <cache name="ubic.gemma.model.common.description.MedicalSubjectHeading" maxElementsInMemory="10000"
           timeToLiveSeconds="1200" overflowToDisk="false"/>

    <cache name="ubic.gemma.model.common.description.MedicalSubjectHeading.qualifiers" maxElementsInMemory="10000"
           timeToLiveSeconds="1200" overflowToDisk="false"/>

    <cache name="ubic.gemma.model.common.description.BibRefAnnotation" maxElementsInMemory="10000"
           timeToLiveSeconds="1200" overflowToDisk="false"/>

    <cache name="ubic.gemma.model.common.description.Keyword" maxElementsInMemory="10000"
           timeToLiveSeconds="1200" overflowToDisk="false"/>

    <cache name="ubic.gemma.model.common.auditAndSecurity.Person" maxElementsInMemory="10000"
           timeToLiveSeconds="1200" overflowToDisk="false"/>

    <cache name="ubic.gemma.model.common.auditAndSecurity.UserGroup" maxElementsInMemory="10000"
           timeToLiveSeconds="1200" overflowToDisk="false"/>

    <cache name="ubic.gemma.model.common.auditAndSecurity.UserGroup.notedReferenceLists" maxElementsInMemory="10000"
           timeToLiveSeconds="1200" overflowToDisk="false"/>

    <cache name="ubic.gemma.model.common.auditAndSecurity.UserGroup.authorities" maxElementsInMemory="10000"
           timeToLiveSeconds="1200" overflowToDisk="false"/>

    <cache name="ubic.gemma.model.common.auditAndSecurity.Contact" maxElementsInMemory="10000"
           timeToLiveSeconds="1200" overflowToDisk="false"/>

    <cache name="ubic.gemma.model.common.auditAndSecurity.User" maxElementsInMemory="10000"
           timeToLiveSeconds="1200" overflowToDisk="false"/>

    <cache name="ubic.gemma.model.common.auditAndSecurity.User.referenceLists" maxElementsInMemory="10000"
           timeToLiveSeconds="1200" overflowToDisk="false"/>

    <cache name="ubic.gemma.model.common.auditAndSecurity.User.jobs" maxElementsInMemory="10000"
           timeToLiveSeconds="1200" overflowToDisk="false"/>

    <cache name="ubic.gemma.model.common.auditAndSecurity.GroupAuthority" maxElementsInMemory="10000"
           timeToLiveSeconds="1200" overflowToDisk="false"/>

    <cache name="ubic.gemma.model.common.auditAndSecurity.JobInfo" maxElementsInMemory="10000"
           timeToLiveSeconds="1200" overflowToDisk="false"/>

    <!-- audit events and their types are immutables, so the cache can be eternal -->
    <cache name="ubic.gemma.model.common.auditAndSecurity.AuditEvent" maxElementsInMemory="10000"
           eternal="true" overflowToDisk="false"/>
    <cache name="ubic.gemma.model.common.auditAndSecurity.eventType.AuditEventType" maxElementsInMemory="10000"
           eternal="true" overflowToDisk="false"/>

    <cache name="ubic.gemma.model.common.auditAndSecurity.curation.CurationDetails" maxElementsInMemory="10000"
           timeToLiveSeconds="1200" overflowToDisk="false"/>

    <cache name="ubic.gemma.model.common.measurement.Measurement" maxElementsInMemory="10000"
           timeToLiveSeconds="1200" overflowToDisk="false"/>

    <cache name="ubic.gemma.model.common.measurement.Unit" maxElementsInMemory="10000"